<?xml version="1.0" encoding="UTF-8"?>
<xs:schema xmlns:xs="http://www.w3.org/2001/XMLSchema">

    <xs:simpleType name="nota">
        <xs:restriction base="xs:string">
            <xs:pattern value="(\d*.\d{2}|No presentado)"></xs:pattern>
        </xs:restriction>
    </xs:simpleType>

    <xs:element name="nombre"></xs:element>
    <xs:element name="apellidos"></xs:element>
    <xs:element name="comentario"></xs:element>
    <xs:attribute name="dni" type="xs:string"></xs:attribute>
    <xs:attribute name="nota" type="nota" ></xs:attribute>
    <xs:attribute name="edad" type="xs:int"></xs:attribute>
    
    <xs:element name="alumno">
        <xs:complexType>
            <xs:sequence>
                <xs:element ref="nombre"></xs:element>
                <xs:element ref="apellidos"></xs:element>
                <xs:element ref="comentario" minOccurs="0"></xs:element>
            </xs:sequence>
            <xs:attribute ref="edad" use="optional"></xs:attribute>
            <xs:attribute ref="dni"></xs:attribute>
            <xs:attribute ref="nota"></xs:attribute>
        </xs:complexType>
    </xs:element>

    <xs:element name="alumnos">
        <xs:complexType>
            <xs:sequence>
                <xs:element ref="alumno" maxOccurs="unbounded"></xs:element>
            </xs:sequence>
        </xs:complexType>
    </xs:element>
</xs:schema>